{
  "$schema": "https://json-schema.org/draft/2020-12/schema",
  "$id": "https://state-system.local/schemas/company-capability-pack.schema.json",
  "title": "CompanyCapabilityPack",
  "type": "object",
  "required": [
    "id",
    "company_ref",
    "generated_at",
    "identity",
    "source_connectors",
    "raw_corpus",
    "evidence_index",
    "index_manifests",
    "company_memory_refs",
    "operating_picture_refs",
    "action_surface",
    "tool_capability_bindings",
    "governance",
    "connector_preflight",
    "runtime_constraints",
    "freshness",
    "invariant"
  ],
  "properties": {
    "id": { "type": "string" },
    "company_ref": { "type": "string" },
    "generated_at": { "type": "string" },
    "identity": {
      "type": "object",
      "required": ["name", "summary", "primary_agent_refs"],
      "properties": {
        "name": { "type": "string" },
        "summary": { "type": "string" },
        "primary_agent_refs": {
          "type": "array",
          "items": { "type": "string" }
        },
        "oversight_agent_refs": {
          "type": "array",
          "items": { "type": "string" },
          "default": []
        }
      }
    },
    "source_connectors": {
      "type": "array",
      "items": { "$ref": "#/$defs/source_connector" }
    },
    "raw_corpus": {
      "type": "object",
      "required": ["definition", "source_refs"],
      "properties": {
        "definition": { "type": "string" },
        "source_refs": {
          "type": "array",
          "items": { "type": "string" }
        }
      }
    },
    "evidence_index": {
      "type": "object",
      "required": ["definition", "index_refs"],
      "properties": {
        "definition": { "type": "string" },
        "index_refs": {
          "type": "array",
          "items": { "type": "string" }
        }
      }
    },
    "index_manifests": {
      "type": "array",
      "items": { "$ref": "#/$defs/index_manifest" }
    },
    "company_memory_refs": {
      "type": "array",
      "items": { "type": "string" }
    },
    "operating_picture_refs": {
      "type": "array",
      "items": { "type": "string" }
    },
    "action_surface": {
      "type": "object",
      "required": ["definition", "action_refs"],
      "properties": {
        "definition": { "type": "string" },
        "action_refs": {
          "type": "array",
          "items": { "type": "string" }
        }
      }
    },
    "tool_capability_bindings": {
      "type": "array",
      "items": { "$ref": "#/$defs/tool_capability_binding" }
    },
    "governance": {
      "type": "object",
      "required": ["definition", "governance_refs"],
      "properties": {
        "definition": { "type": "string" },
        "governance_refs": {
          "type": "array",
          "items": { "type": "string" }
        }
      }
    },
    "connector_preflight": {
      "type": "object",
      "required": ["definition", "required_checks"],
      "properties": {
        "definition": { "type": "string" },
        "required_checks": {
          "type": "array",
          "items": { "$ref": "#/$defs/preflight_check" }
        }
      }
    },
    "runtime_constraints": {
      "type": "object",
      "required": ["definition", "constraints"],
      "properties": {
        "definition": { "type": "string" },
        "constraints": {
          "type": "array",
          "items": { "type": "string" }
        }
      }
    },
    "freshness": {
      "type": "object",
      "required": ["as_of", "stale_after", "watermark_refs"],
      "properties": {
        "as_of": { "type": "string" },
        "stale_after": { "type": "string" },
        "watermark_refs": {
          "type": "array",
          "items": { "type": "string" }
        }
      }
    },
    "lineage": {
      "type": "object",
      "properties": {
        "source_refs": {
          "type": "array",
          "items": { "type": "string" },
          "default": []
        },
        "evidence_refs": {
          "type": "array",
          "items": { "type": "string" },
          "default": []
        }
      }
    },
    "invariant": {
      "type": "object",
      "required": [
        "declares_context",
        "proves_live_access",
        "authorizes_execution",
        "live_access_proven_by",
        "protected_action_authorized_by"
      ],
      "properties": {
        "declares_context": { "type": "boolean" },
        "proves_live_access": { "type": "boolean" },
        "authorizes_execution": { "type": "boolean" },
        "live_access_proven_by": { "type": "string" },
        "protected_action_authorized_by": { "type": "string" }
      }
    }
  },
  "$defs": {
    "source_connector": {
      "type": "object",
      "required": ["id", "connector_type", "source_ref", "owner"],
      "properties": {
        "id": { "type": "string" },
        "connector_type": {
          "type": "string",
          "pattern": "^[a-z0-9_]+$"
        },
        "source_ref": { "type": "string" },
        "source_module_ref": { "type": "string" },
        "module_registry_ref": { "type": "string" },
        "module_mode": { "type": "string" },
        "owner": {
          "type": "string",
          "enum": ["state_system", "agent_runtime", "source_system"]
        },
        "declared": { "type": "boolean" },
        "preflight_target": { "$ref": "#/$defs/preflight_target" }
      }
    },
    "preflight_target": {
      "type": "object",
      "required": ["kind"],
      "properties": {
        "kind": {
          "type": "string",
          "enum": ["msgvault_search"]
        },
        "account_ref": {
          "type": "string",
          "pattern": "^msgvault:account:.+@.+$"
        },
        "query": { "type": "string" },
        "limit": {
          "type": "integer",
          "minimum": 1
        }
      },
      "allOf": [
        {
          "if": {
            "properties": { "kind": { "const": "msgvault_search" } },
            "required": ["kind"]
          },
          "then": {
            "required": ["query", "limit"]
          }
        }
      ]
    },
    "index_manifest": {
      "type": "object",
      "required": [
        "index_ref",
        "company_ref",
        "owner",
        "backend",
        "scope",
        "record_kinds",
        "source_refs",
        "connector_refs",
        "query_surface",
        "status"
      ],
      "properties": {
        "index_ref": { "type": "string" },
        "company_ref": { "type": "string" },
        "owner": {
          "type": "string",
          "enum": ["state_system", "source_system", "agent_runtime"]
        },
        "backend": { "type": "string" },
        "scope": {
          "type": "string",
          "enum": [
            "raw_source_index",
            "interpreted_state_index",
            "company_memory_index"
          ]
        },
        "record_kinds": {
          "type": "array",
          "items": { "type": "string" }
        },
        "source_refs": {
          "type": "array",
          "items": { "type": "string" }
        },
        "connector_refs": {
          "type": "array",
          "items": { "type": "string" }
        },
        "query_surface": {
          "type": "object",
          "required": ["type"],
          "properties": {
            "type": {
              "type": "string",
              "enum": ["agent_runtime_tool", "state_system_runtime", "source_adapter"]
            },
            "tool_ref": { "type": "string" },
            "endpoint_ref": { "type": "string" }
          }
        },
        "status": {
          "type": "string",
          "enum": ["declared", "planned", "disabled"]
        },
        "notes": { "type": "string" }
      }
    },
    "tool_capability_binding": {
      "type": "object",
      "required": [
        "id",
        "capability_ref",
        "tool_ref",
        "action_ref",
        "connector_refs",
        "required_preflight_refs",
        "governance_refs",
        "allowed_agent_refs",
        "exposure_policy",
        "proves_live_access",
        "authorizes_execution"
      ],
      "properties": {
        "id": { "type": "string" },
        "capability_ref": { "type": "string" },
        "tool_ref": { "type": "string" },
        "action_ref": { "type": "string" },
        "connector_refs": {
          "type": "array",
          "items": { "type": "string" }
        },
        "required_preflight_refs": {
          "type": "array",
          "items": { "type": "string" }
        },
        "governance_refs": {
          "type": "array",
          "items": { "type": "string" }
        },
        "allowed_agent_refs": {
          "type": "array",
          "items": { "type": "string" }
        },
        "exposure_policy": {
          "type": "string",
          "enum": [
            "hide_until_preflight_passes",
            "available_after_preflight_governance_gates_effects",
            "require_governance_before_execution"
          ]
        },
        "proves_live_access": { "type": "boolean" },
        "authorizes_execution": { "type": "boolean" }
      }
    },
    "preflight_check": {
      "type": "object",
      "required": ["id", "connector_ref", "check", "owner"],
      "properties": {
        "id": { "type": "string" },
        "connector_ref": { "type": "string" },
        "check": { "type": "string" },
        "owner": {
          "type": "string",
          "enum": ["agent_runtime", "state_system"]
        }
      }
    }
  }
}
