{
  "id": "company_capability_pack.portfolio_co",
  "company_ref": "company.portfolio_co",
  "generated_at": "2026-05-14T12:00:00Z",
  "identity": {
    "name": "PortfolioCo",
    "summary": "Company substrate for PortfolioCo scientific, regulatory, and investor work.",
    "primary_agent_refs": [
      "persona.chloe"
    ],
    "oversight_agent_refs": [
      "persona.nova"
    ]
  },
  "source_connectors": [
    {
      "id": "connector.portfolio_co.kb",
      "connector_type": "kb",
      "source_ref": "kb:tenant:portfolio_co",
      "owner": "source_system",
      "declared": true
    },
    {
      "id": "connector.portfolio_co.drive",
      "connector_type": "gws_drive",
      "source_ref": "gws:example:shared-drive:demo-co",
      "owner": "source_system",
      "declared": true
    },
    {
      "id": "connector.portfolio_co.msgvault",
      "connector_type": "msgvault",
      "source_ref": "msgvault:tenant:portfolio_co-email",
      "owner": "source_system",
      "declared": true,
      "preflight_target": {
        "kind": "msgvault_search",
        "query": "portfolio_co-email",
        "limit": 1
      }
    },
    {
      "id": "connector.portfolio_co.local",
      "connector_type": "local_path",
      "source_ref": "local:/srv/examples/portfolio_co",
      "owner": "source_system",
      "declared": true
    }
  ],
  "raw_corpus": {
    "definition": "raw_corpus is the searchable source set still owned by source systems.",
    "source_refs": [
      "kb:tenant:portfolio_co",
      "gws:example:shared-drive:demo-co",
      "msgvault:tenant:portfolio_co-email",
      "local:/srv/examples/portfolio_co"
    ]
  },
  "evidence_index": {
    "definition": "evidence_index contains search/index refs over raw_corpus and is not truth.",
    "index_refs": [
      "kb:index:tenant:portfolio_co",
      "gws:index:shared:demo-co",
      "msgvault:index:portfolio_co-email"
    ]
  },
  "index_manifests": [
    {
      "index_ref": "index.portfolio_co.kb.corpus",
      "company_ref": "company.portfolio_co",
      "owner": "source_system",
      "backend": "postgres_pgvector",
      "scope": "raw_source_index",
      "record_kinds": [
        "note",
        "document",
        "source_summary"
      ],
      "source_refs": [
        "kb:tenant:portfolio_co"
      ],
      "connector_refs": [
        "connector.portfolio_co.kb"
      ],
      "query_surface": {
        "type": "agent_runtime_tool",
        "tool_ref": "tool.agent_runtime.kb.search"
      },
      "status": "declared"
    },
    {
      "index_ref": "index.portfolio_co.msgvault.email",
      "company_ref": "company.portfolio_co",
      "owner": "source_system",
      "backend": "msgvault_native",
      "scope": "raw_source_index",
      "record_kinds": [
        "email",
        "thread",
        "source_summary"
      ],
      "source_refs": [
        "msgvault:tenant:portfolio_co-email"
      ],
      "connector_refs": [
        "connector.portfolio_co.msgvault"
      ],
      "query_surface": {
        "type": "agent_runtime_tool",
        "tool_ref": "tool.agent_runtime.msgvault.search"
      },
      "status": "declared"
    },
    {
      "index_ref": "index.portfolio_co.drive.corpus",
      "company_ref": "company.portfolio_co",
      "owner": "source_system",
      "backend": "gws_drive_native",
      "scope": "raw_source_index",
      "record_kinds": [
        "document",
        "file_metadata",
        "source_summary"
      ],
      "source_refs": [
        "gws:example:shared-drive:demo-co"
      ],
      "connector_refs": [
        "connector.portfolio_co.drive"
      ],
      "query_surface": {
        "type": "agent_runtime_tool",
        "tool_ref": "tool.agent_runtime.gws_drive.read"
      },
      "status": "declared"
    },
    {
      "index_ref": "index.portfolio_co.state_system.evidence_cards",
      "company_ref": "company.portfolio_co",
      "owner": "state_system",
      "backend": "postgres_pgvector",
      "scope": "interpreted_state_index",
      "record_kinds": [
        "evidence_card",
        "claim",
        "company_memory",
        "operating_picture"
      ],
      "source_refs": [
        "state-system:company.portfolio_co"
      ],
      "connector_refs": [],
      "query_surface": {
        "type": "state_system_runtime",
        "tool_ref": "tool.state_system.vector_search"
      },
      "status": "planned"
    }
  ],
  "company_memory_refs": [
    "company_memory.portfolio_co"
  ],
  "operating_picture_refs": [
    "operating_picture.scientific.portfolio_co",
    "operating_picture.regulatory.portfolio_co",
    "operating_picture.investor.portfolio_co"
  ],
  "action_surface": {
    "definition": "action_surface lists actions available in principle, not necessarily credentialed.",
    "action_refs": [
      "action_surface.portfolio_co.read_knowledge_store",
      "action_surface.portfolio_co.read_drive",
      "action_surface.portfolio_co.search_msgvault",
      "action_surface.portfolio_co.inspect_local_workspace"
    ]
  },
  "tool_capability_bindings": [
    {
      "id": "tool_binding.portfolio_co.kb.search",
      "capability_ref": "capability.portfolio_co.kb.search",
      "tool_ref": "tool.agent_runtime.kb.search",
      "action_ref": "action_surface.portfolio_co.read_knowledge_store",
      "connector_refs": [
        "connector.portfolio_co.kb"
      ],
      "required_preflight_refs": [
        "preflight.portfolio_co.kb"
      ],
      "governance_refs": [],
      "allowed_agent_refs": [
        "persona.chloe",
        "persona.nova"
      ],
      "exposure_policy": "hide_until_preflight_passes",
      "proves_live_access": false,
      "authorizes_execution": false
    },
    {
      "id": "tool_binding.portfolio_co.drive.read",
      "capability_ref": "capability.portfolio_co.drive.read",
      "tool_ref": "tool.agent_runtime.gws_drive.read",
      "action_ref": "action_surface.portfolio_co.read_drive",
      "connector_refs": [
        "connector.portfolio_co.drive"
      ],
      "required_preflight_refs": [
        "preflight.portfolio_co.drive"
      ],
      "governance_refs": [],
      "allowed_agent_refs": [
        "persona.chloe",
        "persona.nova"
      ],
      "exposure_policy": "hide_until_preflight_passes",
      "proves_live_access": false,
      "authorizes_execution": false
    },
    {
      "id": "tool_binding.portfolio_co.msgvault.search",
      "capability_ref": "capability.portfolio_co.msgvault.search",
      "tool_ref": "tool.agent_runtime.msgvault.search",
      "action_ref": "action_surface.portfolio_co.search_msgvault",
      "connector_refs": [
        "connector.portfolio_co.msgvault"
      ],
      "required_preflight_refs": [
        "preflight.portfolio_co.msgvault"
      ],
      "governance_refs": [],
      "allowed_agent_refs": [
        "persona.chloe",
        "persona.nova"
      ],
      "exposure_policy": "hide_until_preflight_passes",
      "proves_live_access": false,
      "authorizes_execution": false
    },
    {
      "id": "tool_binding.portfolio_co.local.inspect",
      "capability_ref": "capability.portfolio_co.local.inspect",
      "tool_ref": "tool.agent_runtime.local_path.inspect",
      "action_ref": "action_surface.portfolio_co.inspect_local_workspace",
      "connector_refs": [
        "connector.portfolio_co.local"
      ],
      "required_preflight_refs": [
        "preflight.portfolio_co.local"
      ],
      "governance_refs": [],
      "allowed_agent_refs": [
        "persona.chloe",
        "persona.nova",
        "persona.atlas"
      ],
      "exposure_policy": "hide_until_preflight_passes",
      "proves_live_access": false,
      "authorizes_execution": false
    }
  ],
  "governance": {
    "definition": "governance is approval and authority policy for state promotion and protected actions.",
    "governance_refs": [
      "governance.company.portfolio_co.external_action",
      "governance.company.portfolio_co.scientific_regulatory_sensitive"
    ]
  },
  "connector_preflight": {
    "definition": "connector_preflight is the agent runtime check spec/result boundary.",
    "required_checks": [
      {
        "id": "preflight.portfolio_co.kb",
        "connector_ref": "connector.portfolio_co.kb",
        "check": "agent runtime can search Knowledge Store tenant portfolio_co.",
        "owner": "agent_runtime"
      },
      {
        "id": "preflight.portfolio_co.drive",
        "connector_ref": "connector.portfolio_co.drive",
        "check": "agent runtime can read PortfolioCo Biotechnologies shared drive through gws-account shared.",
        "owner": "agent_runtime"
      },
      {
        "id": "preflight.portfolio_co.msgvault",
        "connector_ref": "connector.portfolio_co.msgvault",
        "check": "agent runtime can search PortfolioCo msgvault email where applicable.",
        "owner": "agent_runtime"
      },
      {
        "id": "preflight.portfolio_co.local",
        "connector_ref": "connector.portfolio_co.local",
        "check": "agent runtime can inspect the local PortfolioCo path when locally available.",
        "owner": "agent_runtime"
      }
    ]
  },
  "runtime_constraints": {
    "definition": "runtime_constraints are agent runtime execution constraints, separate from governance.",
    "constraints": [
      "Chloe primary for PortfolioCo.",
      "Nova may oversee across company packs.",
      "Atlas technical/repo scope only by default.",
      "No Linear connector is declared unless explicitly added later."
    ]
  },
  "freshness": {
    "as_of": "2026-05-14T12:00:00Z",
    "stale_after": "2026-05-21T12:00:00Z",
    "watermark_refs": [
      "company_capability_pack.portfolio_co@2026-05-14T12:00:00Z"
    ]
  },
  "lineage": {
    "source_refs": [
      "coordination:agent-runtime-company-scoped-access:2026-05-14"
    ],
    "evidence_refs": [
      "docs:state-system:company-capability-baseline"
    ]
  },
  "invariant": {
    "declares_context": true,